[
  {
    "cluster_id": "C-insufficient-stop-condition",
    "title": "Cluster: insufficient-stop-condition",
    "issue_class": "insufficient-stop-condition",
    "affected_modes": [
      "efficiency",
      "stall-conditions"
    ],
    "member_findings": [
      "eff-r1-101-f2",
      "sta-r1-100-f0",
      "sta-r1-100-f1",
      "sta-r2-200-f0",
      "sta-r2-200-f1",
      "sta-r2-202-f0",
      "sta-r2-202-f1"
    ],
    "representative_examples": [
      "eff-r1-101",
      "sta-r1-100"
    ],
    "aggregate": {
      "severity": 3,
      "prevalence": 0.78,
      "improvement_leverage": 0.6,
      "regression_risk": 2,
      "min_fidelity": "L0",
      "confirmed_members": 5
    },
    "likely_root_cause": "Recurring insufficient-stop-condition across 7 findings",
    "fix_locus": "stop-conditions",
    "rank_score": 0.73,
    "stability": {
      "first_seen_round": 1,
      "rounds_observed": 3
    }
  },
  {
    "cluster_id": "C-cost-explosion",
    "title": "Cluster: cost-explosion",
    "issue_class": "cost-explosion",
    "affected_modes": [
      "efficiency"
    ],
    "member_findings": [
      "eff-r1-101-f0",
      "eff-r1-101-f1"
    ],
    "representative_examples": [
      "eff-r1-101",
      "eff-r1-101"
    ],
    "aggregate": {
      "severity": 2,
      "prevalence": 0.22,
      "improvement_leverage": 0.6,
      "regression_risk": 2,
      "min_fidelity": "L2",
      "confirmed_members": 2
    },
    "likely_root_cause": "Recurring cost-explosion across 2 findings",
    "fix_locus": "stop-conditions",
    "rank_score": 0.232,
    "stability": {
      "first_seen_round": 1,
      "rounds_observed": 3
    }
  }
]